{
  "$schema": "https://json-schema.org/draft/2020-12/schema",
  "$id": "https://underleague.dev/schemas/consumables.schema.json",
  "title": "Underleague consumable",
  "description": "data/consumables/<id>.json: catálogo mínimo (4, uno por familia de RF-084) para que el mercado cumpla RF-114 ('cuatro categorías simultáneas'). Añadido por el paquete X junto a data/items (ver Sim.Run.Systems.Consumables.ConsumableCatalog para el límite declarado: comprar no gatea equipar todavía). Sin campo 'description' (RT-035); mismo formato de efecto recortado que data/items.",
  "type": "object",
  "properties": {
    "_doc": { "type": "string" },
    "id": { "type": "string", "pattern": "^[a-z][a-z0-9_]*$" },
    "name": { "$ref": "#/$defs/localizedName" },
    "rarity": { "enum": ["common", "uncommon", "rare", "legendary"] },
    "family": {
      "description": "RF-084: médicos, tácticos, sucios y sobrenaturales.",
      "enum": ["medical", "tactical", "dirty", "supernatural"]
    },
    "suggestedTrigger": {
      "description": "ADR 0172: el disparador con el que el jugador (y la política automática) deja el consumible cuando lo pasa de manual a condicional, coherente con lo que promete su nombre: el grito de aguantar cuando el marcador está empatado, no cuando se va perdiendo. Nombre de RF-083 sin umbral. Provisional, sin medir.",
      "enum": ["scoreBehind", "scoreTied", "lastSeconds", "mobStart", "ownInjury", "ownRedCard"]
    },
    "effects": {
      "type": "array",
      "items": { "$ref": "#/$defs/effect" },
      "minItems": 1
    }
  },
  "required": ["id", "name", "rarity", "family", "suggestedTrigger", "effects"],
  "additionalProperties": false,
  "$defs": {
    "localizedName": {
      "type": "object",
      "properties": {
        "es": { "type": "string", "minLength": 1 },
        "en": { "type": "string", "minLength": 1 }
      },
      "required": ["es", "en"],
      "additionalProperties": false
    },
    "effect": {
      "type": "object",
      "properties": {
        "type": { "enum": ["modifyAttribute", "modifyProbability", "shout", "provokeMob"] },
        "order": { "enum": ["Defensive", "Offensive"], "description": "ADR 0166, sólo con shout: la orden táctica con la que juega el equipo mientras dura el grito." },
        "press": { "const": true, "description": "ADR 0166, sólo con shout: la consigna de presión (más peso a perseguir y entrar al portador) en lugar de una orden. Exactamente uno de order y press." },
        "seconds": { "type": "integer", "minimum": 1, "maximum": 30, "description": "ADR 0166, con shout: duración del grito en segundos de juego; después el equipo vuelve a su orden. ADR 0167, con provokeMob: lo que dura la conducta que imponga la turba provocada." },
        "target": { "enum": ["team", "opposingTeam"], "description": "A quién alcanza: al equipo propio (por defecto) o a los rivales en el campo. Un consumible no tiene portador. Necesario para los canales de quien SUFRE la consecuencia (severeInjury, injury)." },
        "attribute": { "enum": ["strength", "speed", "technique", "stamina", "leash"] },
        "probability": {
          "enum": [
            "foul", "card", "injury", "injure", "severeInjury", "pass", "intercept",
            "dribble", "tackle", "shotOnTarget", "save", "tackleEvasion", "interceptEvasion"
          ]
        },
        "value": { "type": "integer", "minimum": -5000, "maximum": 5000, "description": "Puntos de atributo en modifyAttribute; en modifyProbability, el PORCENTAJE DE CUOTA con signo de la ADR 0050 P1 (+-15, +-30, +-50, +-100, +-200, +-300, +-500), acotado por el TECHO DE SU RAREZA de la ADR 0058 (comun 100, poco comun 200, raro 300, legendario 500), que comprueba el cargador." }
      },
      "required": ["type"],
      "additionalProperties": false,
      "allOf": [
        {
          "if": { "properties": { "type": { "const": "shout" } }, "required": ["type"] },
          "then": {
            "required": ["seconds"],
            "oneOf": [{ "required": ["order"] }, { "required": ["press"] }],
            "not": { "anyOf": [{ "required": ["value"] }, { "required": ["target"] }, { "required": ["attribute"] }, { "required": ["probability"] }] }
          }
        },
        {
          "if": { "properties": { "type": { "const": "provokeMob" } }, "required": ["type"] },
          "then": {
            "required": ["seconds"],
            "not": { "anyOf": [{ "required": ["order"] }, { "required": ["press"] }, { "required": ["value"] }, { "required": ["target"] }, { "required": ["attribute"] }, { "required": ["probability"] }] }
          }
        },
        {
          "if": { "properties": { "type": { "enum": ["modifyAttribute", "modifyProbability"] } }, "required": ["type"] },
          "then": {
            "required": ["value"],
            "not": { "anyOf": [{ "required": ["order"] }, { "required": ["press"] }, { "required": ["seconds"] }] }
          }
        },
        {
          "if": { "properties": { "type": { "const": "modifyAttribute" } }, "required": ["type"] },
          "then": { "required": ["attribute"] }
        },
        {
          "if": { "properties": { "type": { "const": "modifyProbability" } }, "required": ["type"] },
          "then": { "required": ["probability"] }
        }
      ]
    }
  }
}
