{
  "_doc": "BA-H (catálogo, RF-084 tácticos), ADR 0166: grito del entrenador para el slot manual (RF-082). '¡A por él!' es la consigna de presión: 6 s en los que todo el equipo va a por el portador (ai.press en weights.json: más peso a perseguir, presionar y entrar), con el coste natural de faltas que trae ir a por todas. Sin multiplicadores de éxito invisibles. Duración provisional, sin medir. Común.",
  "id": "after_him",
  "name": {
    "es": "¡A por él!",
    "en": "After Him!"
  },
  "rarity": "common",
  "family": "tactical",
  "suggestedTrigger": "scoreBehind",
  "effects": [
    {
      "type": "shout",
      "press": true,
      "seconds": 6
    }
  ]
}
