{
  "_doc": "BA-H (catálogo, RF-084 tácticos): el techo de la familia táctica, legendario (500, ADR 0058) — el entrenador ha visto algo en el rival y lo suelta todo de golpe: piernas más rápidas y el balón circulando sin parar.",
  "id": "master_plan",
  "name": {
    "es": "Plan maestro",
    "en": "Master Plan"
  },
  "rarity": "legendary",
  "family": "tactical",
  "suggestedTrigger": "scoreTied",
  "effects": [
    {
      "type": "modifyAttribute",
      "attribute": "speed",
      "value": 20
    },
    {
      "type": "modifyProbability",
      "probability": "pass",
      "value": 300
    }
  ]
}
