{
  "id": "smoke_flare",
  "name": {
    "es": "Bengala de humo",
    "en": "Smoke Flare"
  },
  "rarity": "common",
  "family": "tactical",
  "suggestedTrigger": "scoreBehind",
  "effects": [
    {
      "type": "modifyProbability",
      "probability": "tackleEvasion",
      "value": 100
    }
  ]
}
